domanda,risposta
"Ciao","Ciao! Sono Sephora, il tuo assistente virtuale. Come posso aiutarti oggi?"
"Come stai?","Sto bene, grazie! Sono qui per assisterti. Come posso esserti utile?"
"Qual è il tuo nome?","Il mio nome è Sephora. Sono un assistente virtuale creato per aiutarti."
"Che tempo fa oggi?","Mi dispiace, non ho accesso alle informazioni meteorologiche in tempo reale. Potresti controllare un sito web meteo per informazioni accurate."
"Cosa sai fare?","Posso rispondere a domande su vari argomenti, fornire informazioni generali, dire l'ora e la data, e assistere con compiti semplici. Chiedimi pure!"
"Raccontami una barzelletta","Perché il pomodoro arrossisce? Perché ha visto l'insalata svestirsi!"
"Qual è la capitale dell'Italia?","La capitale dell'Italia è Roma."
"Chi ha dipinto la Monna Lisa?","La Monna Lisa è stata dipinta da Leonardo da Vinci."
"Quanti pianeti ci sono nel sistema solare?","Attualmente, ci sono 8 pianeti riconosciuti nel nostro sistema solare: Mercurio, Venere, Terra, Marte, Giove, Saturno, Urano e Nettuno."
"Come si dice 'grazie' in francese?","'Grazie' in francese si dice 'Merci'."
"Quale è l'animale terrestre più grande?","L'animale terrestre più grande è l'elefante africano."
"Quando è stata fondata Roma?","Secondo la tradizione, Roma fu fondata il 21 aprile del 753 a.C."
"Chi ha scritto 'I Promessi Sposi'?","'I Promessi Sposi' è stato scritto da Alessandro Manzoni."
"Qual è il fiume più lungo del mondo?","Il fiume più lungo del mondo è il Nilo, in Africa."
"Chi ha inventato la lampadina?","La lampadina è stata inventata da Thomas Edison, anche se ci furono altri inventori che contribuirono al suo sviluppo."
"Qual è la montagna più alta del mondo?","La montagna più alta del mondo è il Monte Everest, situato nella catena dell'Himalaya."
"Chi ha scritto la Divina Commedia?","La Divina Commedia è stata scritta da Dante Alighieri."
"Qual è l'oceano più grande?","L'oceano più grande è l'Oceano Pacifico."
"Chi era Giulio Cesare?","Giulio Cesare era un leader militare e politico dell'antica Roma, famoso per le sue conquiste e per aver trasformato la Repubblica romana in quello che sarebbe diventato l'Impero Romano."
"Qual è il paese più popoloso del mondo?","Il paese più popoloso del mondo è la Cina, seguita dall'India."
"Chi ha inventato il telefono?","Il telefono è stato inventato da Alexander Graham Bell nel 1876."
"Qual è la lingua più parlata al mondo?","La lingua più parlata al mondo come prima lingua è il cinese mandarino."
"Chi ha scritto 'Romeo e Giulietta'?","'Romeo e Giulietta' è stata scritta da William Shakespeare."
"Qual è il deserto più grande del mondo?","Il deserto più grande del mondo è il Sahara in Africa."
"Chi è stato il primo uomo sulla Luna?","Il primo uomo a camminare sulla Luna è stato Neil Armstrong, il 20 luglio 1969."
"Qual è l'animale più veloce sulla terra?","L'animale terrestre più veloce è il ghepardo."
"Chi ha dipinto 'La Notte Stellata'?","'La Notte Stellata' è stata dipinta da Vincent van Gogh."
"Qual è la valuta del Giappone?","La valuta del Giappone è lo Yen."
"Chi ha scoperto l'America?","Cristoforo Colombo è tradizionalmente accreditato per la scoperta dell'America nel 1492, anche se i Vichinghi avevano raggiunto il Nord America secoli prima."
"Qual è l'edificio più alto del mondo?","L'edificio più alto del mondo è il Burj Khalifa a Dubai, negli Emirati Arabi Uniti."
"Chi ha scritto 'Il Piccolo Principe'?","'Il Piccolo Principe' è stato scritto da Antoine de Saint-Exupéry."
"Qual è il più grande paese dell'Unione Europea per superficie?","Il più grande paese dell'Unione Europea per superficie è la Francia."
"Chi ha composto la Nona Sinfonia?","La Nona Sinfonia è stata composta da Ludwig van Beethoven."
"Qual è il simbolo chimico dell'oro?","Il simbolo chimico dell'oro è Au."
"Chi era Leonardo da Vinci?","Leonardo da Vinci era un polimata italiano del Rinascimento, noto come pittore, scienziato, inventore e scrittore."
"Qual è la capitale del Brasile?","La capitale del Brasile è Brasilia."
"Chi ha scritto '1984'?","'1984' è stato scritto da George Orwell."
"Qual è il più grande mammifero marino?","Il più grande mammifero marino è la balenottera azzurra."
"Chi ha inventato la penicillina?","La penicillina è stata scoperta da Alexander Fleming nel 1928."
"Qual è il più grande arcipelago del mondo?","Il più grande arcipelago del mondo è l'Indonesia."
"Chi era Marie Curie?","Marie Curie era una fisica e chimica polacca-francese, pioniera nello studio della radioattività e prima donna a vincere un Premio Nobel."
"Qual è la capitale dell'Australia?","La capitale dell'Australia è Canberra."
"Chi ha dipinto 'Guernica'?","'Guernica' è stata dipinta da Pablo Picasso."
"Qual è il più piccolo paese del mondo?","Il più piccolo paese del mondo è lo Stato della Città del Vaticano."
"Chi ha inventato Internet?","Internet è stato sviluppato da molti scienziati e ingegneri, ma Tim Berners-Lee è spesso accreditato per aver inventato il World Wide Web."
"Qual è l'ora attuale?","[ORA_ATTUALE]"
"Che giorno è oggi?","[GIORNO_ATTUALE]"
"Che ora è?","[ORA_ATTUALE]"
"Qual è la data di oggi?","[DATA_ATTUALE]"
"Dimmi l'ora","[ORA_ATTUALE]"
"Sai dirmi che giorno è?","[GIORNO_ATTUALE]"
"Arrivederci","Arrivederci! È stato un piacere aiutarti. Torna pure quando vuoi!"
